{
  "baselineMutationPerformed": false,
  "blockers": [
    "30 serious accessibility violations",
    "QA status is FAIL, not PASS",
    "model visual review failed at P1",
    "viewport QA failed: wide-desktop-1440x1000, desktop-1280x900, compact-1024x768, tablet-768x1024, mobile-390x844"
  ],
  "candidateRoot": "artifacts/design/consuming-surfaces/quotepilot/screenshots/quotepilot-existing-landing-v2",
  "candidates": {
    "compact-1024x768": {
      "path": "artifacts/design/consuming-surfaces/quotepilot/screenshots/quotepilot-existing-landing-v2/compact-1024x768/current.png",
      "sha256": "adee7da8097169ef706f5c069aa1c009d230808aeb83dc5ec368678186759cda"
    },
    "desktop-1280x900": {
      "path": "artifacts/design/consuming-surfaces/quotepilot/screenshots/quotepilot-existing-landing-v2/desktop-1280x900/current.png",
      "sha256": "7206b3702cd2d9ac1eb4a7c77c1baef745f32cd5f3b9d7add4219fbaece3e113"
    },
    "mobile-390x844": {
      "path": "artifacts/design/consuming-surfaces/quotepilot/screenshots/quotepilot-existing-landing-v2/mobile-390x844/current.png",
      "sha256": "541a9cbf250d446b70e3e9e5b7bff5f112e889f815e262d0d35bf4e0ba032fbf"
    },
    "tablet-768x1024": {
      "path": "artifacts/design/consuming-surfaces/quotepilot/screenshots/quotepilot-existing-landing-v2/tablet-768x1024/current.png",
      "sha256": "8da4675c89974ab4586b4e4c7a16ad53d31e70c1598b705593934319e3c838ec"
    },
    "wide-desktop-1440x1000": {
      "path": "artifacts/design/consuming-surfaces/quotepilot/screenshots/quotepilot-existing-landing-v2/wide-desktop-1440x1000/current.png",
      "sha256": "9e608f7e21941064e8b6047b44d7d76bf9523eb37ba61045e7d95a8388b97a96"
    }
  },
  "id": "BR-9C2D4593B699634F",
  "modelEvidence": {
    "path": "artifacts/design/consuming-surfaces/quotepilot/reports/quotepilot-existing-landing-v2/model-visual-review.json",
    "severity": "P1",
    "sha256": "11343ffa721d05dbf55d01530ada7678e47e8c8ea0814a285d494b8f4effb12d",
    "verdict": "FAIL"
  },
  "product": "QuotePilot",
  "promotionAuthority": "human-required",
  "qaEvidence": {
    "path": "artifacts/design/consuming-surfaces/quotepilot/reports/quotepilot-existing-landing-v2/qa-report.json",
    "sha256": "cf5bd866f623faa017cbaa9dde159d3d7c1c02d32012b0dae433af3cb6aa725d",
    "status": "FAIL"
  },
  "requestedAt": "2026-08-21T09:08:30.092227Z",
  "requestedBy": "agent:codex",
  "requiredHumanApprovals": [
    "Product owner visual acceptance",
    "Manual semantic accessibility review",
    "Accepted design-memory decision authorizing baseline promotion"
  ],
  "scenarioId": "quotepilot-existing-landing-v2",
  "schemaVersion": 1,
  "sourceRevision": {
    "branch": "feature/landing-document-hero",
    "commitSha": "c0b213f2e728365c66a272d3d0277c46ce51d3e7",
    "repository": "quoteflow"
  },
  "status": "BLOCKED",
  "surface": "QuotePilot existing public landing"
}
